{
  "schema_version": 2,
  "status": "draft",
  "title": "AI 原生知识工作流",
  "audience": "产品团队、知识工作者与组织管理者",
  "purpose": "说明 AI 原生知识工作流的核心变化与行动路径",
  "page_count": 6,
  "central_message": "把散落的信息、判断和行动接成一条能持续复用的工作流。",
  "narrative": {
    "opening": "信息越来越多，但上下文仍在不断丢失。",
    "problem": "资料、判断与行动分散在不同工具和短期记忆中。",
    "insight": "真正需要积累的是可复用的上下文，而不是更多文件。",
    "method": "通过收集、关联、判断、行动形成闭环。",
    "action": "先改造一条高频流程，再逐步扩展。"
  },
  "slides": [
    {
      "id": "s01",
      "role": "cover",
      "claim": "AI 原生知识工作流",
      "exact_text": [
        "AI 原生知识工作流",
        "让上下文持续产生价值"
      ],
      "purpose": "建立主题与核心判断",
      "evidence": [],
      "visual_brief": "A quiet network of notes and paths with generous negative space",
      "transition": "进入下一层叙事",
      "visual_anchor_id": "deck-anchor",
      "continuity_group": "cover",
      "layout_plan": {
        "text_safe_zone": "left-bottom",
        "visual_zone": "right or center-right",
        "hierarchy": "headline > supporting copy > visual anchor",
        "density": "low; one dominant visual anchor"
      }
    },
    {
      "id": "s02",
      "role": "statement",
      "claim": "问题不是信息太少，而是上下文不断丢失",
      "exact_text": [
        "信息很多，上下文却在丢失",
        "资料散落",
        "判断失联",
        "行动断点"
      ],
      "purpose": "明确问题",
      "evidence": [],
      "visual_brief": "Scattered fragments becoming a connected field of context",
      "transition": "进入下一层叙事",
      "visual_anchor_id": "deck-anchor",
      "continuity_group": "knowledge-flow",
      "layout_plan": {
        "text_safe_zone": "left",
        "visual_zone": "right or center-right",
        "hierarchy": "headline > supporting copy > visual anchor",
        "density": "low; one dominant visual anchor"
      }
    },
    {
      "id": "s03",
      "role": "comparison",
      "claim": "从文件堆积转向上下文复用",
      "exact_text": [
        "从文件堆积，转向上下文复用",
        "过去：保存结果",
        "现在：保存判断过程"
      ],
      "purpose": "提出转变",
      "evidence": [],
      "visual_brief": "A visual shift from isolated stacks to connected pathways",
      "transition": "进入下一层叙事",
      "visual_anchor_id": "deck-anchor",
      "continuity_group": "knowledge-flow",
      "layout_plan": {
        "text_safe_zone": "left",
        "visual_zone": "right or center-right",
        "hierarchy": "headline > supporting copy > visual anchor",
        "density": "low; one dominant visual anchor"
      }
    },
    {
      "id": "s04",
      "role": "process",
      "claim": "四个动作构成闭环",
      "exact_text": [
        "四个动作构成闭环",
        "收集现场",
        "建立关联",
        "形成判断",
        "推进行动"
      ],
      "purpose": "解释方法",
      "evidence": [],
      "visual_brief": "Four clear stages moving through one continuous path",
      "transition": "进入下一层叙事",
      "visual_anchor_id": "deck-anchor",
      "continuity_group": "knowledge-flow",
      "layout_plan": {
        "text_safe_zone": "left",
        "visual_zone": "right or center-right",
        "hierarchy": "headline > supporting copy > visual anchor",
        "density": "low; one dominant visual anchor"
      }
    },
    {
      "id": "s05",
      "role": "data",
      "claim": "价值来自复用次数，而不是文件数量",
      "exact_text": [
        "价值 = 上下文质量 × 复用次数",
        "一次整理，多次调用"
      ],
      "purpose": "给出价值判断",
      "evidence": [],
      "visual_brief": "Repeated reuse represented as a small signal becoming a durable system",
      "transition": "进入下一层叙事",
      "visual_anchor_id": "deck-anchor",
      "continuity_group": "knowledge-flow",
      "layout_plan": {
        "text_safe_zone": "left",
        "visual_zone": "right or center-right",
        "hierarchy": "headline > supporting copy > visual anchor",
        "density": "low; one dominant visual anchor"
      }
    },
    {
      "id": "s06",
      "role": "closing",
      "claim": "先重做一条高频流程",
      "exact_text": [
        "先重做一条高频流程",
        "把上下文、判断和行动连起来"
      ],
      "purpose": "给出行动建议",
      "evidence": [],
      "visual_brief": "One focused workflow moving forward with calm visual momentum",
      "transition": "结束",
      "visual_anchor_id": "deck-anchor",
      "continuity_group": "knowledge-flow",
      "layout_plan": {
        "text_safe_zone": "left-bottom",
        "visual_zone": "right or center-right",
        "hierarchy": "headline > supporting copy > visual anchor",
        "density": "low; one dominant visual anchor"
      }
    }
  ]
}
